{
  "schema_version": 1,
  "mode": "spatial",
  "language": "ko",
  "title": "세 번째 incident face가 생긴 edge를 직접 검사합니다",
  "summary": "After state에서 edge 0–1에 세 개 face가 연결됩니다. 빨간 overlay는 production trace가 제공한 non-manifold edge index이며 Canvas가 topology를 다시 계산한 결과가 아닙니다.",
  "status": "revise",
  "evidence_status": "mixed",
  "snapshot": {
    "label": "representative mutation trace",
    "ref": "mesh-case-017"
  },
  "findings": [
    {
      "severity": "high",
      "title": "non-manifold edge가 mutation 결과에 남습니다",
      "summary": "production trace의 issue index가 edge 0–1을 지목합니다. rejection timing과 rollback은 별도 runtime anchor가 필요합니다.",
      "evidence_refs": [
        "issue-index",
        "rollback-gap"
      ]
    }
  ],
  "next_action": {
    "kind": "next",
    "label": "mutation 전 validation에서 같은 입력을 거부하고 topology identity가 유지되는지 관찰합니다"
  },
  "visual": {
    "type": "spatial",
    "initial_state": "after",
    "caption": "Timeline에서 Before/After를 바꾸고 Ghost previous를 켜 차이를 겹쳐 보세요. 빨간 edge는 supplied issue index입니다.",
    "asset": {
      "format": "buffer_geometry",
      "geometry": {
        "positions": [
          0,
          -1,
          0,
          0,
          1,
          0,
          -1,
          0,
          0,
          1,
          0,
          0,
          0,
          0,
          1
        ],
        "indices": [
          0,
          1,
          2,
          1,
          0,
          3,
          0,
          1,
          4
        ],
        "face_ids": [
          "face-left",
          "face-right",
          "face-added"
        ],
        "vertex_ids": [
          "edge-a",
          "edge-b",
          "left",
          "right",
          "added"
        ]
      }
    },
    "states": [
      {
        "id": "before",
        "label": "Before · 2 incident faces",
        "asset": {
          "format": "buffer_geometry",
          "geometry": {
            "positions": [
              0,
              -1,
              0,
              0,
              1,
              0,
              -1,
              0,
              0,
              1,
              0,
              0,
              0,
              0,
              1
            ],
            "indices": [
              0,
              1,
              2,
              1,
              0,
              3
            ],
            "face_ids": [
              "face-left",
              "face-right"
            ]
          }
        }
      },
      {
        "id": "after",
        "label": "After · 3 incident faces",
        "asset": {
          "format": "buffer_geometry",
          "geometry": {
            "positions": [
              0,
              -1,
              0,
              0,
              1,
              0,
              -1,
              0,
              0,
              1,
              0,
              0,
              0,
              0,
              1
            ],
            "indices": [
              0,
              1,
              2,
              1,
              0,
              3,
              0,
              1,
              4
            ],
            "face_ids": [
              "face-left",
              "face-right",
              "face-added"
            ]
          }
        }
      }
    ],
    "overlays": [
      {
        "kind": "non_manifold",
        "label": "non-manifold edge · source 0–1",
        "edges": [
          0,
          1
        ],
        "evidence_refs": [
          "issue-index"
        ]
      },
      {
        "kind": "added",
        "label": "added face · source face-added",
        "state_refs": [
          "after"
        ],
        "faces": [
          2
        ],
        "evidence_refs": [
          "mutation-trace"
        ]
      }
    ]
  },
  "evidence": [
    {
      "id": "issue-index",
      "title": "Production issue overlay",
      "status": "observed",
      "kind": "runtime",
      "source": "trace://mesh-case-017/issues",
      "summary": "runtime trace가 edge source indices [0, 1]을 non-manifold로 분류했습니다."
    },
    {
      "id": "mutation-trace",
      "title": "Mutation before/after topology",
      "status": "observed",
      "kind": "runtime",
      "source": "trace://mesh-case-017/topology",
      "summary": "before/after vertex와 face indices를 같은 identity space에서 수집했습니다."
    },
    {
      "id": "rollback-gap",
      "title": "Rejection and rollback evidence",
      "status": "unverified",
      "kind": "runtime",
      "source": "pre-mutation rejection trace unavailable",
      "summary": "거부 시점과 원본 topology 보존은 이 trace만으로 확정할 수 없습니다."
    }
  ],
  "participation": [
    {
      "kind": "explainer_generated",
      "status": "observed",
      "detail": "Canvas artifact rendered"
    },
    {
      "kind": "scenario_exercised",
      "status": "unverified",
      "detail": "사용자 상호작용은 artifact 생성만으로 추정하지 않습니다."
    }
  ]
}
